[
  {
    "iso2": "GB",
    "iso3": "GBR",
    "un_m49": 826,
    "country_name": "United Kingdom",
    "region": "Europe",
    "income_group": "high",
    "population": 67736802,
    "government_type": "Constitutional monarchy / parliamentary democracy",
    "constitution_url": "https://www.legislation.gov.uk/ukpga/2011/1/contents",
    "sovereign_status": "un_member",
    "pilot": true
  },
  {
    "iso2": "US",
    "iso3": "USA",
    "un_m49": 840,
    "country_name": "United States",
    "region": "Americas",
    "income_group": "high",
    "population": 334914895,
    "government_type": "Federal presidential republic",
    "constitution_url": "https://www.archives.gov/founding-docs/constitution",
    "sovereign_status": "un_member",
    "pilot": true
  },
  {
    "iso2": "DK",
    "iso3": "DNK",
    "un_m49": 208,
    "country_name": "Denmark",
    "region": "Europe",
    "income_group": "high",
    "population": 5910913,
    "government_type": "Constitutional monarchy / parliamentary democracy",
    "constitution_url": "https://www.ft.dk/da/dokumenter/grundloven",
    "sovereign_status": "un_member",
    "pilot": true
  },
  {
    "iso2": "IN",
    "iso3": "IND",
    "un_m49": 356,
    "country_name": "India",
    "region": "Asia",
    "income_group": "lower_middle",
    "population": 1428627663,
    "government_type": "Federal parliamentary republic",
    "constitution_url": "https://www.india.gov.in/my-government/constitution-india",
    "sovereign_status": "un_member",
    "pilot": true
  },
  {
    "iso2": "SG",
    "iso3": "SGP",
    "un_m49": 702,
    "country_name": "Singapore",
    "region": "Asia",
    "income_group": "high",
    "population": 5917648,
    "government_type": "Parliamentary republic",
    "constitution_url": "https://sso.agc.gov.sg/Act/Constitution1963",
    "sovereign_status": "un_member",
    "pilot": true
  }
]